{
  "$schema": "http://json-schema.org/draft-07/schema#",
  "$id": "https://socioprophet.dev/agent-registry/schemas/containment-policy.v0.1.schema.json",
  "title": "ContainmentPolicy",
  "description": "An enforceable containment policy that bounds a destructive/offensive agent's capabilities. Named by a policy://containment/<name> ref from an admission manifest and resolved to governance/containment/<name>.json. tools/authorize.py DENIES a destructive/offensive action unless this policy file resolves AND its required_conditions are satisfied by the action context (deny-by-default). A containment ref that does not resolve to a real policy file is a fail-closed DENY.",
  "type": "object",
  "additionalProperties": false,
  "required": [
    "schemaVersion",
    "recordType",
    "policy_ref",
    "governs_capabilities",
    "default_effect",
    "required_conditions",
    "invariant",
    "standard_ref"
  ],
  "properties": {
    "schemaVersion": { "const": "agent-registry.containment-policy.v0.1" },
    "recordType": { "const": "ContainmentPolicy" },
    "policy_ref": {
      "type": "string",
      "pattern": "^policy://containment/",
      "description": "Canonical ref, matching the admission manifest's containment ref and this file's name."
    },
    "title": { "type": "string" },
    "description": { "type": "string" },
    "governs_capabilities": {
      "type": "array",
      "minItems": 1,
      "items": { "type": "string" }
    },
    "default_effect": {
      "type": "string",
      "enum": ["deny"],
      "description": "Deny-by-default. The verb is denied outside the required_conditions."
    },
    "denied_environments": {
      "type": "array",
      "items": { "type": "string" }
    },
    "required_conditions": {
      "type": "object",
      "additionalProperties": false,
      "description": "Every present condition MUST be satisfied by the action context. A missing context value for a present condition is treated as unmet (fail-closed).",
      "properties": {
        "environment_in": { "type": "array", "items": { "type": "string" } },
        "require_sandbox": { "type": "boolean" },
        "require_human_in_loop": { "type": "boolean" },
        "require_read_only": { "type": "boolean" },
        "min_quorum_approvers": { "type": "integer", "minimum": 1 },
        "namespace_scope_in": { "type": "array", "items": { "type": "string" } }
      }
    },
    "enforcement": { "type": "string" },
    "owner_repo": { "type": "string" },
    "invariant": { "const": "INV-ACC-1" },
    "standard_ref": { "type": "string" },
    "signoff_ref": { "type": "string" },
    "gap_refs": { "type": "array", "items": { "type": "string" } }
  }
}
