{
  "schemaVersion": "agent-registry.containment-policy.v0.1",
  "recordType": "ContainmentPolicy",
  "policy_ref": "policy://containment/scope-d-exploit-sandbox-v0.1",
  "title": "SCOPE-D offensive exploit containment (sandbox + human-in-loop)",
  "description": "Bounds the SCOPE-D offensive exploit subagent (Bash / Write / WebFetch / WebSearch). Exploitation is destructive: deny-by-default and run ONLY in an isolated non-production sandbox, under human-in-the-loop, within a single namespace, with no cross-namespace reach.",
  "governs_capabilities": [
    "Read",
    "Write",
    "Bash",
    "Grep",
    "Glob",
    "WebSearch",
    "WebFetch"
  ],
  "default_effect": "deny",
  "denied_environments": [
    "prod",
    "production",
    "staging"
  ],
  "required_conditions": {
    "environment_in": [
      "sandbox"
    ],
    "require_sandbox": true,
    "require_human_in_loop": true,
    "namespace_scope_in": [
      "single"
    ]
  },
  "enforcement": "deny-by-default: tools/authorize.py DENIES the action unless every required_condition is satisfied by the action context and this policy file resolves. A missing context value for a required condition is treated as unmet (fail-closed).",
  "owner_repo": "SocioProphet/SCOPE-D",
  "invariant": "INV-ACC-1",
  "standard_ref": "socioprophet-agent-standards/docs/standards/030",
  "signoff_ref": "governance/owner-signoffs/2026-08-02-agent-admissions.json",
  "gap_refs": [
    "SocioProphet/agent-registry#53",
    "SocioProphet/agent-registry#54",
    "SocioProphet/agent-registry#55"
  ]
}
