{
  "schemaVersion": "agent-registry.containment-policy.v0.1",
  "recordType": "ContainmentPolicy",
  "policy_ref": "policy://containment/kill-agent-quorum-sandbox-v0.1",
  "title": "kill.agent / governance-control containment (quorum + sandbox)",
  "description": "Bounds the governor agent's destructive governance verbs (kill.agent, policy.evaluate, quorum.vote). Deny-by-default: the verb is exercised ONLY in a non-production sandbox, under human-in-the-loop, with a 2-approver quorum, and within a single namespace.",
  "governs_capabilities": [
    "kill.agent",
    "policy.evaluate",
    "quorum.vote"
  ],
  "default_effect": "deny",
  "denied_environments": [
    "prod",
    "production"
  ],
  "required_conditions": {
    "environment_in": [
      "dev",
      "staging",
      "sandbox"
    ],
    "require_sandbox": true,
    "require_human_in_loop": true,
    "min_quorum_approvers": 2,
    "namespace_scope_in": [
      "single"
    ]
  },
  "enforcement": "deny-by-default: tools/authorize.py DENIES the action unless every required_condition is satisfied by the action context and this policy file resolves. A missing context value for a required condition is treated as unmet (fail-closed).",
  "owner_repo": "SocioProphet/agent_descriptors",
  "invariant": "INV-ACC-1",
  "standard_ref": "socioprophet-agent-standards/docs/standards/030",
  "signoff_ref": "governance/owner-signoffs/2026-08-02-agent-admissions.json",
  "gap_refs": [
    "SocioProphet/agent-registry#53",
    "SocioProphet/agent-registry#54",
    "SocioProphet/agent-registry#55"
  ]
}
